Conference,Year,Title,PaperType,Matched,Abstract,Highlights,Link,AuthorNames,AuthorAffiliation,Coder1,Coder2,Coder3,Vote,Exceptions
Nicotine & Tobacco Research,2016,Is There a Relationship Between the Concentration of Same-Sex Couples and Tobacco Retailer Density?,article,"['bisexual', 'gay', 'lesbian', 'same-sex', 'sex']","Background: Tobacco use is markedly higher among lesbian, gay, and bisexual populations than heterosexuals. Higher density of tobacco retailers is found in neighborhoods with lower income and more racial/ethnic minorities. Same-sex couples tend to live in similar neighborhoods, but the association of this demographic with tobacco retailer density has not been examined. Methods:  For a national sample of 97 US counties, we calculated the number of tobacco retailers per 1000 persons and rates of same-sex couples per 1000 households in each census tract ( n = 17 941). Using spatial regression, we examined the association of these variables in sex-stratified models, including neighborhood demographics and other environmental characteristics to examine confounding.  Results: Results from spatial regression show that higher rates of both female and male same-sex couples were associated with a higher density of tobacco retailers. However the magnitude of this association was small. For female couples, the association was not significant after controlling for area-level characteristics, such as percent black, percent Hispanic, median household income, the presence of interstate highways, and urbanicity, which are neighborhood correlates of higher tobacco retailer density. For male couples, the association persisted after control for these characteristics. Conclusion: Same-sex couples reside in areas with higher tobacco retailer density, and for men, this association was not explained by neighborhood confounders, such as racial/ethnic composition and income. While lesbian, gay, and bisexual disparities in tobacco use may be influenced by neighborhood environment, the magnitude of the association suggests other explanations of these disparities remain important areas of research.",,http://dx.doi.org/10.1093/ntr/ntv046,"Lee, Joseph G. L.; Pan, William K.; Henriksen, Lisa; Goldstein, Adam O.; Ribisl, Kurt M.","Department of Health Behavior, Gillings School of Global Public Health, University of North Carolina at Chapel Hill , Chapel Hill, NC ;  Nicholas School of Environment and Duke Global Health Institute, Duke University , Durham, NC ;  Stanford Prevention Research Center, Stanford School of Medicine , Palo Alto, CA ;  Department of Family Medicine, School of Medicine, University of North Carolina at Chapel Hill , Chapel Hill, NC ;  Lineberger Comprehensive Cancer Center, School of Medicine, University of North Carolina at Chapel Hill , Chapel Hill, NC Department of Health Behavior, Gillings School of Global Public Health, University of North Carolina at Chapel Hill , Chapel Hill, NC ;  Lineberger Comprehensive Cancer Center, School of Medicine, University of North Carolina at Chapel Hill , Chapel Hill, NC",,,1,1,
Nicotine & Tobacco Research,2016,"Minority Stress, Smoking Patterns, and Cessation Attempts: Findings From a Community-Sample of Transgender Women in the San Francisco Bay Area",article,"['bisexual', 'gay', 'lesbian', 'sex', 'transgender']","Introduction: Research has demonstrated associations between reports of minority stressors and smoking behaviors among lesbian, gay, and bisexual populations; however, little is known about how minority stressors are related to smoking behaviors and cessation attempts among transgender women. The purpose of this study was twofold: (1) to examine the associations between transgender-based discrimination and smoking patterns among a sample of transgender women; and (2) to identify barriers to smoking cessation in a sample of transgender women with a history of smoking. Methods: A community sample of 241 transgender women completed a one-time survey. Binary and multinomial logistic regression models examined associations between minority stressors and (1) smoking behaviors and (2) cessation attempts. Both models adjusted for income, education, race/ethnicity, recent sex work, HIV status, depression, alcohol use, and current hormone use. Results:  Overall, 83% of participants indicated that they had smoked a cigarette in the last month. Of these women, 62.3% reported daily smoking and 51.7% reported an unsuccessful quit attempt. Discrimination was positively associated with currently smoking (adjusted odds ratio [ AOR ] = 1.04, 95% confidence interval [CI]: 1.01, 1.08). Discrimination was positively associated with unsuccessful cessation ( AOR = 1.03, 95% CI: 1.01, 1.18) and never attempting ( AOR = 1.04, 95% CI: 1.01, 1.11) compared to successful cessation. Discrimination was also positively associated with never attempting compared to unsuccessful cessation ( AOR = 1.01, 95% CI: 1.00, 1.03).  Conclusions: Smoking cessation may be driven by unique transgender-related minority stressors, such as discrimination. Future research is warranted to address unique stigmatizing contexts when understanding and providing tailored intervention addressing smoking among transgender women.",,http://dx.doi.org/10.1093/ntr/ntv066,"Gamarel, Kristi E.; Mereish, Ethan H.; Manning, David; Iwamoto, Mariko; Operario, Don; Nemoto, Tooru","Department of Psychiatry and Human Behavior, Alpert Medical School of Brown University , Providence, RI ;  Center for Alcohol and Addiction Studies, Brown University , Providence, RI ;   Department of Behavioral and Social Sciences, School of Public Health,  Brown University , Providence, RI ;   Department of Behavioral and Social Sciences, School of Public Health,  Brown University , Providence, RI ;  Public Health Institute , Oakland, CA Department of Psychiatry and Human Behavior, Alpert Medical School of Brown University , Providence, RI ;  Center for Alcohol and Addiction Studies, Brown University , Providence, RI ;   Department of Behavioral and Social Sciences, School of Public Health,  Brown University , Providence, RI ;  Public Health Institute , Oakland, CA",,,1,1,
Nicotine & Tobacco Research,2016,"Smoking Cessation Awareness and Utilization Among Lesbian, Gay, Bisexual, and Transgender Adults: An Analysis of the 2009–2010 National Adult Tobacco Survey",article,"['bisexual', 'gay', 'heterosexual', 'lesbian', 'lgbt', 'transgender']","Introduction: Each year, there are more than 480 000 deaths in the United States attributed to smoking. Lesbian, gay, bisexual and transgender (LGBT) adults are a vulnerable population that smokes at higher rates than heterosexuals. Methods:  We used data collected from the National Adult Tobacco Survey 2009–2010, a large, nationally representative study using a randomized, national sample of US landline and cellular telephone listings, ( N = 118 590). We compared LGBT adults to their heterosexual counterparts with regard to exposure to advertisements promoting smoking cessation, and awareness and use of tobacco treatment services, including quitlines, smoking cessation classes, health professional counseling, nicotine replacement therapy, and medications.  Results: Fewer GBT men, compared to heterosexual men, were aware of the quitline. However, LGBT individuals have similar exposure to tobacco cessation advertising, as well as similar awareness of and use of evidence based cessation methods as compared to heterosexual peers. Conclusions: The similarly of awareness and use of cessation support indicates a need for LGBT-specific efforts to reduce smoking disparities. Potential interventions would include: improving awareness of, access to and acceptability of current cessation methods for LGBT patients, developing tailored cessation interventions, and denormalizing smoking in LGBT community spaces.",,http://dx.doi.org/10.1093/ntr/ntv103,"Fallin, Amanda; Lee, Youn Ok; Bennett, Keisa; Goodin, Amie","Tobacco Policy Research Program, College of Nursing, University of Kentucky , Lexington, KY ;  Public Health Research Division, RTI International , Research Triangle Park, NC ;  Department of Family and Community Medicine, College of Medicine, University of Kentucky , Lexington, KY ;  Institute for Pharmaceutical Outcomes and Policy, University of Kentucky , Lexington, KY",,,1,1,
Nicotine & Tobacco Research,2016,Awareness and Use of Dissolvable Tobacco Products in the United States,article,"['bisexual', 'gay', 'lesbian', 'lgbt', 'transgender']","Introduction: Little is known about dissolvable tobacco products (DTPs) compared with other alternative tobacco products (ATPs) like e-cigarettes and snus. We sought to understand US adults’ awareness and use of DTPs. Methods:  A nationally representative sample of US adults (age ≥ 18 years, N = 17 522) completed an online survey in March 2013 assessing their awareness and use of DTPs.  Results: Approximately 16% of all respondents were aware of DTPs. Few reported ever using DTPs (1.6%). DTP awareness among all respondents was greatest among males, younger adults, current and former smokers, never married respondents, blacks and Latinos, and those who used other ATPs. Among current smokers, DTP awareness was greatest for males, younger adults, blacks and Latinos, those who used other ATPs, and Southerners. DTP use among all respondents was greatest among males, younger adults, Lesbian, Gay, Bisexual, and Transgender (LGBT) respondents, former and current smokers, and those who used other ATPs. Among current smokers, DTP use was greatest among males, younger adults, LGBT respondents, those who used other ATPs, those who intended to quit, and those who received medical advice to quit. Conclusions: DTP awareness and use have increased since 2009. DTPs are being used as smoking cessation aids thereby increasing risk of polytobacco use. Medical professionals should emphasize use of empirically-supported smoking cessation aids when advising patients to quit. Regulations are needed to prevent tobacco company promotion of DTPs as smoking cessation aids and to inform consumers of the risks associated with DTPs and polytobacco use. Increased national surveillance of DTP use is recommended.",,http://dx.doi.org/10.1093/ntr/ntv212,"Cabrera-Nguyen, E. Peter; Cavazos-Rehg, Patricia; Krauss, Melissa; Kim, Yoonsang; Emery, Sherry","Department of Psychiatry, Washington University School of Medicine , St. Louis, MO ;  Department of Psychiatry, Washington University School of Medicine , St. Louis, MO ;  Department of Psychiatry, Washington University School of Medicine , St. Louis, MO ;  Institute for Health Research and Policy, University of Illinois at Chicago , Chicago, IL ;  School of Public Health, University of Illinois College of Medicine at Chicago , Chicago, IL",,,1,1,
Nicotine & Tobacco Research,2016,"Intragroup Variance in Lesbian, Gay, and Bisexual Tobacco Use Behaviors: Evidence That Subgroups Matter, Notably Bisexual Women",article,"['bisexual', 'bisexuals', 'gay', 'gender', 'heterosexual', 'lesbian', 'lgb', 'non-lgb']","Introduction: Emerging evidence suggests bisexual populations are at increased risk for a variety of negative health outcomes, including tobacco use. Lesbian, gay, and bisexual (LGB) populations are at increased risk for cigarette smoking, but research on LGB subpopulations’ use of tobacco products beyond cigarettes and tobacco use differences across LGB subgroups is in its infancy. This study explores differences in use of tobacco products across LGB subgroups, including gender differences among bisexuals. Methods: This study reports results from a 2013 nationally-representative cross-sectional online survey of US adults (N = 17 087). Weighted tobacco use prevalence and adjusted logistic regression results are reported. Results: LGB populations reported higher current use of any tobacco product (35.7%) and current use of cigarettes (32.0%), e-cigarettes (8.9%), regular (5.5%) and small cigars (11.6%), compared with non-LGB. Bisexual (odds ratio [OR] = 2.6, 95% confidence interval [CI]: 1.7–3.9) and lesbian (OR = 1.7, 95% CI: 1.0–2.7) women have higher odds of any tobacco use than heterosexual women; including greater odds of regular (OR = 2.9, 95% CI: 1.2–7.0 and OR = 2.2, 95% CI: 1.3–3.9; respectively) and small cigar use (OR = 2.4, 95% CI: 1.4–4.1 and OR = 3.2, 95% CI: 2.0–5.1; respectively). Gay men had lower odds of cigar use (OR = 0.4, 95% CI: 0.2–0.8) than heterosexual men. Conclusions: This is the first US adult population study to assess differences in use of various tobacco products across adult LGB subpopulations and by gender, confirming their increased risk of use and illuminating differences by subgroup and gender. Exploring LGB as a unified population appears inadequate to accurately characterize LGB tobacco use risk. Tobacco-related LGB health inequities, particularly among bisexual and lesbian women, may be greater than previously indicated. Implications: This manuscript provides important contributions to the field of tobacco control and prevention, and more specifically to LGB tobacco-related health disparities research. This is among the first population level studies to explore various tobacco use across LGB populations and across genders, comparing results to non-LGB populations in a national study. We provide novel evidence that bisexual women in particular, have a higher risk for use of various tobacco products, compared with other LGB subpopulations. In order to address this disparity, tobacco control professionals need to be made aware of these important differences in tobacco use behavior.",,http://dx.doi.org/10.1093/ntr/ntv208,"Emory, Kristen; Kim, Yoonsang; Buchting, Francisco; Vera, Lisa; Huang, Jidong; Emery, Sherry L.","Health Media Collaboratory, Institute for Health Research and Policy, University of Illinois at Chicago, Chicago, IL; Moores Cancer Center at the University of California, San Diego, La Jolla, CA; Health Media Collaboratory, Institute for Health Research and Policy, University of Illinois at Chicago, Chicago, IL; Moores Cancer Center, Horizons Foundation, San Francisco, CA Health Media Collaboratory, Institute for Health Research and Policy, University of Illinois at Chicago, Chicago, IL; Moores Cancer Center at the University of California, San Diego, La Jolla, CA; Health Media Collaboratory, Institute for Health Research and Policy, University of Illinois at Chicago, Chicago, IL; Health Media Collaboratory, Institute for Health Research and Policy, University of Illinois at Chicago, Chicago, IL;",,,1,1,
Nicotine & Tobacco Research,2016,Structural Discrimination is Associated With Smoking Status Among a National Sample of Transgender Individuals,article,"['gender', 'gender identity', 'transgender']","Introduction: Limited evidence suggests that transgender individuals smoke at significantly higher rates than the general population. We aimed to determine whether structural or everyday discrimination experiences predict smoking behavior among transgender individuals when sociodemographic, health, and gender-specific factors were controlled. Methods: Data from the National Transgender Discrimination Survey (N = 4781), a cross-sectional online and paper survey distributed to organizations serving the transgender community, were analyzed in order to determine the association between current smoking and discrimination experiences and other potential predictors. Logistic regression models were used to establish factors that predict smoking. Results: Participants reported experiencing both structural (80.4%) and everyday (65.9%) discrimination. Multivariate analyses showed that participants who reported attending some college, graduating college, or having a graduate degree were less likely to smoke compared to those with a high school degree or less. Uninsured participants were more likely to report smoking compared to those with private insurance. Those who used alcohol or drugs for coping were also more likely to smoke. Participants whose IDs and records listed their preferred gender were less likely to smoke (OR = 0.84); those who had experienced structural discrimination were more like to report smoking (OR = 1.65). Conclusions: Further research is needed in order to explore the relationship between smoking and legal transition among transgender individuals. Strategies to prevent smoking and encourage cessation among this vulnerable population are also needed. In addition, comprehensive collection of gender identity data in the context of national surveys, tobacco-related research, and clinical settings is sorely needed. Implications: This study establishes a link between experiences of structural discrimination among transgender individuals and smoking status.",,http://dx.doi.org/10.1093/ntr/ntv221,"Shires, Deirdre A.; Jaffee, Kim D.","School of Social Work, Wayne State University, Detroit, MI School of Social Work, Wayne State University, Detroit, MI",,,1,1,
Nicotine & Tobacco Research,2017,Can Smoke-Free Policies Reduce Tobacco Use Disparities of Sexual and Gender Minorities in Missouri?,article,"['gender', 'gender minority', 'sexual and gender minority']","Objective The purpose of this study is to explore the associations between smoke-free policies, current and former smoking status, personal smoking restrictions, and intention to quit among sexual and gender minority (SGM) and non-SGM individuals in Missouri. Aims and Methods The current analysis derives from the Out, Proud and Healthy project. Chi-squares examined differences between SGM (N = 2210) and non-SGM (N = 586) respondents and former (N = 836) and current (N = 1960) smokers on smoking-related variables. Odds ratios and 95% confidence intervals from logistic regression identified variables associated with former (vs. current) smoking. Results SGM current smokers (25%) were significantly more likely than SGM former smokers (19%) to live in a community without a smoke-free policy. Among SGM current smokers, significantly greater intention to quit was seen in those living in a smoke-free community with a smoke-free policy of two or more years (94%) compared with those living in a community without a smoke-free policy (76%). Conclusions Living in an area with smoke-free policies is related to greater intention to quit among SGM current smokers, greater support for smoke-free policies, and lower smoking prevalence for this community. The SGM community may collectively accrue greater public health benefits from the adoption of smoke-free policies than the non-SGM community. Implications Prior to this study, no data are available regarding current and former smoking status among SGM individuals following the implementation of a local smoke-free policy. The purpose of this study was to explore the relationship between smoke-free policies, current and former smoking status, and intention to quit among SGM and non-SGM individuals in Missouri. This study finds evidence of lower current smoking prevalence and greater intentions to quit among SGM current smokers who live in communities with smoke-free policies. The SGM community may collectively accrue greater public health benefits from the adoption of smoke-free policies than the non-SGM community.",,http://dx.doi.org/10.1093/ntr/ntx078,"Wintemberg, Jenna; McElroy, Jane A; Ge, Bin; Everett, Kevin D","Department of Health Sciences, University of Missouri, Columbia, MO; Department of Family and Community Medicine, University of Missouri, Columbia, MO; Department of Medical Research, University of Missouri, Columbia, MO Department of Family and Community Medicine, University of Missouri, Columbia, MO;",,,1,1,
Nicotine & Tobacco Research,2017,"Smoking Cessation Programs for Lesbian, Gay, Bisexual, Transgender, and Intersex People: A Content-Based Systematic Review",article,"['bisexual', 'gay', 'intersex', 'lesbian', 'lesbians', 'lgbt', 'transgender']","Introduction Tobacco use among lesbian, gay, bisexual, and transgender (LGBT) people is double the general population. Limited evidence suggests high smoking rates among intersex people. Lesbian, gay, bisexual, transgender, and intersex (LGBTI) people are a priority population in Australian health policy, particularly mental health and aging. Despite associations between smoking and noncommunicable diseases relevant to aging and mental health, LGBTI-targeted smoking cessation interventions in Australia have been limited to people living with HIV. Applying existing interventions to marginalized populations without modification and evaluation may fail and exacerbate inequities. Aims To assess outcomes and characterize the populations served, cultural modifications, and behavior change techniques (BCTs) of interventions to reduce LGBTI smoking. Methods We searched MEDLINE, six additional databases, and contacted authors to retrieve published and unpublished program evaluations. Results We retrieved 19 studies (3663 participants). None used control groups. Overall quit rate was 61.0% at the end of interventions and stabilized at 38.6% at 3–6 months. All studies included gay men, 13 included lesbians, 13 “LGBT,” 12 bisexual people, five transgender people, and none included intersex people. Transgender people comprised 3% of participants. Of programs open to women, 27.8% of participants were women. Cultural modifications were used by 17 (89.5%) studies, commonly meeting in LGBT spaces, discussing social justice, and discussing LGBT-specific triggers. Common BCTs included providing normative information, boosting motivation/self-efficacy, relapse prevention, social support, action planning, and discussing consequences. Conclusions Quit rates were high; using control groups would improve evaluation. Existing programs may fail to reach groups other than gay men. Implications This review examines the evidence for LGBTI-targeted smoking cessation interventions. Populations within LGBTI are not proportionally represented in smoking cessation research, and no study addressed intersex smoking. Overall, LGBT-targeted interventions appear to be effective, and simply having an LGBT-specific group may be more effective than groups for the general population. More rigorous research is necessary to draw firm conclusions. Our study space analysis provides suggestions for areas of more targeted research on mechanisms underlying these complex interventions’ success.",,http://dx.doi.org/10.1093/ntr/ntw216,"Berger, Israel; Mooney-Somers, Julie","Centre for Values, Ethics and Law in Medicine (VELiM), Sydney School of Public Health, University of Sydney, Sydney, NSW, Australia Centre for Values, Ethics and Law in Medicine (VELiM), Sydney School of Public Health, University of Sydney, Sydney, NSW, Australia",,,1,1,
Nicotine & Tobacco Research,2017,LGBTQ Youth and Young Adult Perspectives on a Culturally Tailored Group Smoking Cessation Program,article,"['lgbtq', 'non-lgbtq']","Introduction The prevalence of smoking among LGBTQ youth and young adults (YYAs) is much higher than that of non-LGBTQ young people. The current study explored LGBTQ YYA perceptions of a culturally tailored group smoking cessation counselling program, along with how the intervention could be improved. Methods We conducted focus groups (n = 24) with 204 LGBTQ YYAs in Toronto and Ottawa, Canada. Open-ended questions focused on their feelings, likes and dislikes, concerns and additional ideas for a culturally tailored group cessation counselling intervention. Focus group transcripts were coded thematically and analyzed. Results Overall, YYAs were ambivalent towards the concept of a culturally tailored, group cessation counselling program. Although several participants were attracted to the LGBTQ friendly and social benefits of such a program (eg, good support system), many also had concerns. Particularly, the possibility that other group members might trigger them to smoke was a frequently stated issue. Focus group members also noted lack of motivation to attend the group, and that the group program may be inaccessible depending on where and when the program was offered. Several suggestions were made as to how to ameliorate the expressed issues related to inaccessibility or lack of attractiveness. Conclusions This study is among the first to gain the perspectives of LGBTQ YYAs on culturally tailored group cessation strategies in Canada. We identified components of group cessation programs that are both favored and not favored among LGBTQ YYAs, as well as suggestions as to how to make group cessation programs more appealing. Implications This study is particularly relevant as smoking cessation programs are one of the most commonly offered and published cessation interventions for the LGBTQ community, yet little is understood in terms of preferences of LGBTQ YYA smokers. Given the disparity in the prevalence of smoking among LGBTQ young people compared to their non-LGBTQ peers, research on effective intervention strategies for this population is needed. Findings from this study can assist practitioners and researchers in designing interventions.",,http://dx.doi.org/10.1093/ntr/ntx011,"Baskerville, Neill Bruce; Shuh, Alanna; Wong-Francq, Katy; Dash, Darly; Abramowicz, Aneta","Propel Centre for Population Health Impact, University of Waterloo,Waterloo, Canada Propel Centre for Population Health Impact, University of Waterloo,Waterloo, Canada Propel Centre for Population Health Impact, University of Waterloo,Waterloo, Canada Propel Centre for Population Health Impact, University of Waterloo,Waterloo, Canada Propel Centre for Population Health Impact, University of Waterloo,Waterloo, Canada",,,1,1,
