Conference,Year,Title,PaperType,Matched,Abstract,Highlights,Link,AuthorNames,AuthorAffiliation,Coder1,Coder2,Coder3,Vote,Exceptions
Nicotine & Tobacco Research,2018,Effects of Sexual Orientation on the Relationship Between Victimization Experiences and Smoking Status Among US Women,article,"['bisexual', 'heterosexual', 'lesbian', 'sexual minority', 'sexual orientation']","Introduction This study examined the relationships between experiences of childhood and adulthood victimization and current smoking among heterosexual and sexual minority women. The main hypothesis was that victimization experiences would predict current smoking status. Further, we hypothesized that the effect of childhood victimization on self-reported smoker status would be mediated by adult victimization. Methods Data are from two studies conducted in the United States that used similar methods and questionnaires in order to conduct a comparative analysis of women based on sexual orientation. Data from Wave 1 (2000–2001) of the Chicago Health and Life Experiences of Women (CHLEW) study and from Wave 5 (2001) of the National Study of Health and Life Experiences of Women (NSHLEW) study were used in these analyses. Results Twenty-eight percent of the sample reported current smoking. Victimization experiences were common, with 63.4% of participants reporting at least one type of victimization in childhood and 40.2% reporting at least one type in adulthood. Women who identified as heterosexual were less likely to be victimized during childhood than were women who identified as lesbian or bisexual. Adult victimization had a significant effect on current smoker status, and the effect of childhood victimization on smoker status was mediated by adult victimization. When examined by sexual orientation, this indirect relationship remained significant only among bisexual women in the sample. Conclusions Study findings make a valuable contribution to the literature on victimization and health risk behaviors such as smoking. Given the negative and long-term impact of victimization on women, strategies are needed that reduce the likelihood of victimization and subsequent engagement in health risk behaviors such as smoking. Implications The study findings make a valuable contribution to the literature on sexual minority women’s health on the influence of victimization on health risk behaviors. With the goal of reducing the likelihood of adult victimization and subsequent engagement in health risk behaviors, programs and policies aimed at preventing victimization of women are warranted. Providers and community health agencies should assess and target physically and sexually abused sexual minority youth for mental health intervention with the goal of interrupting the progression from childhood victimization to adult victimization and subsequent engagement in health risk behaviors.",,http://dx.doi.org/10.1093/ntr/ntx052,"Matthews, Alicia K; Cho, Young Ik; Hughes, Tonda L; Wilsnack, Sharon C; Aranda, Frances; Johnson, Timothy","Department of Health Systems Sciences, College of Nursing, University of Illinois at Chicago, Chicago, IL Department of community and behavioral health promotion, University of Wisconsin Milwaukee, Zilber School of Public Health, Community and Behavioral Health Promotion, Milwaukee, WI Department of Health Systems Sciences, College of Nursing, University of Illinois at Chicago, Chicago, IL Department of Psychiatry and Behavioral Science, University of North Dakota School of Medicine and Health Sciences, Grand Forks, ND Rush University Medical Center, Department of Behavioral Studies, Chicago, IL Department of Behavioral Studies, Survey Research Laboratory, University of Illinois at Chicago, Chicago, IL",,,1,1,
Nicotine & Tobacco Research,2018,Frequent Experience of LGBQ Microaggression on Campus Associated With Smoking Among Sexual Minority College Students,article,"['bisexual', 'gay', 'gender', 'gender minority', 'lesbian', 'lgbq', 'queer', 'questioning', 'sexual and gender minority', 'sexual minorities', 'sexual minority']","Introduction Lesbian, gay, bisexual, or queer/questioning (LGBQ) microaggressions refer to often-unintentional insults, assaults, and invalidations that denigrate sexual minorities. While experiencing hostile discrimination and violence has previously been associated with elevated rates of smoking cigarettes for LGBQ college students, the relationship between LGBQ microaggressions and smoking is unknown. Methods Data from a national anonymous online survey of sexual and gender minority college students were used to examine the relationship between past month cigarette smoking and interpersonal LGBQ microaggressions. Multivariable logistic regression assessed the relationship between smoking and frequent (chronic) experiences of microaggressions, using a hierarchical procedure to control for demographics, predictors of smoking, and academic factors. Results Past year frequent LGBQ microaggression was reported by 48% of respondents and was more common among students who smoked in past 30 days. Experiencing past year physical violence was reported by 15% and did not differ by smoking status. Past year frequent experience of microaggressions was associated with increased odds of 1.72 (95% CI 1.03–2.87) for past 30-day smoking after adjusting for age, gender, race, socioeconomic indicators, alcohol misuse, physical violence, as well as academic stress and engagement. Conclusions The results indicate that frequently experiencing LGBQ microaggressions is a risk factor for LGBQ college students smoking cigarettes. The mechanisms underlying this relationship require additional research, as does identifying positive coping strategies and institutional strategies to address LGBQ microaggressions on campuses. Tobacco control efforts should consider the impact of microaggression on the social environment for the prevention and treatment of tobacco use among LGBQ individuals. Implications Microaggressions related to sexual minority identity include subtle forms of discrimination experienced during daily interactions that can create hostile and stressful social environments for a socially disadvantaged group. Prior research has demonstrated that LGBQ college students have higher rates of cigarette smoking, and that experiencing identity-based violence is a risk factor. This study revealed that experiencing frequent LGBQ microaggressions on college campus is associated with increased likelihood of current smoking among LGBQ college students.",,http://dx.doi.org/10.1093/ntr/ntw305,"Ylioja, Thomas; Cochran, Gerald; Woodford, Michael R; Renn, Kristen A","School of Social Work, University of Pittsburgh, Pittsburgh, PA School of Social Work, University of Pittsburgh, Pittsburgh, PA School of Medicine, Department of Psychiatry, University of Pittsburgh, Pittsburgh, PA Lyle S. Hallman Faculty of Social Work, Wilfrid Laurier University, Waterloo, ON College of Education, Department of Educational Administration, Michigan State University, East Lansing, MI",,,1,1,
Nicotine & Tobacco Research,2018,Sexual and Gender Minority College Students and Tobacco Use in Texas,article,"['bisexual', 'gay', 'gender', 'gender minority', 'heterosexual', 'lesbian', 'queer', 'sexual and gender minority', 'transgender']","Introduction Most research regarding sexual and gender minority (SGM) populations is limited to examination of cigarette or general tobacco use or does not examine heterogeneity across SGM groups other than lesbian or gay and bisexual individuals. This study examined differences in the odds of current use and age of initiation of five tobacco/nicotine products among three groups of SGM young adults who self-identified as (1) gay or lesbian, (2) bisexual, and (3) queer, transgender, or “other,” compared to their heterosexual peers. Methods Participants were 4252 college students aged 18–29 years from 24 colleges in Texas who completed an online tobacco use survey. Multilevel logistic regression models were used to examine the odds of SGM participants currently using each tobacco product. Multilevel linear regression models were used to examine the association of current product users’ SGM status with self-reported age of each product’s initiation. All models were adjusted for sociodemographic factors and accounted for students clustered within each college. Results At least one SGM group had significantly greater odds of currently using every tobacco product type compared to heterosexual participants, except hookah. There were few differences across groups in age of initiation. However, queer, transgender, and “other-” identified participants initiated e-cigarettes 1.34 years younger than heterosexual participants, and bisexual participants initiated smokeless tobacco 3.66 years younger than heterosexual participants. Conclusions Findings highlight some significant tobacco use disparities among SGM young adults compared to their heterosexual peers. Longitudinal studies with larger group sizes will identify prospective predictors of sustained SGM-related tobacco use disparities. Implications This study extends the current literature by including the sexual and gender minority identity options of queer, transgender, and “other,” highlighting disparities in tobacco use between young adults in these subgroups compared to their heterosexual peers, particularly in noncigarette tobacco product use. Findings underscore the need for the Food and Drug Association and other health agencies to tailor health communication efforts specific to sexual and gender minority populations pertaining to the risks and harms surrounding tobacco product use.",,http://dx.doi.org/10.1093/ntr/ntx095,"Hinds, Josephine T; Loukas, Alexandra; Perry, Cheryl L","Department of Kinesiology and Health Education, The University of Texas at Austin, Austin, TX Department of Kinesiology and Health Education, The University of Texas at Austin, Austin, TX The Michael & Susan Dell Center for Healthy Living, UTHealth School of Public Health, Austin Campus, Austin, TX",,,1,1,
Nicotine & Tobacco Research,2018,"Association of Lesbian, Gay, and Bisexual Identity Facets With Smoking Dependence Motives",article,"['bisexual', 'gay', 'heterosexual', 'lesbian', 'lgb', 'sexual orientation']","Introduction Lesbian, gay, and bisexual (LGB) adults have higher rates of smoking than heterosexual adults. LGB individuals face unique stressors, including challenges associated with having a LGB identity. The extent to which these unique stressors are related to dependence motives in LGB adult smokers, however, has not been previously explored. The current study was conducted to redress these gaps. Methods Participants (N = 52; Mage = 42.8; 55.8% Black/African American) were recruited from the local community. Identity facets were measured by the Lesbian, Gay, and Bisexual Identity Scale (LGBIS). Dependence motives were measured by the Brief Wisconsin Inventory of Smoking Dependence Motives. Linear multiple regressions were calculated with the predictors of seven LGBIS subscales for primary and secondary dependence motives, respectively. Results Primary dependence motives (core nicotine dependence features) were predicted by affirmation of LGB identity (β = 0.44). Secondary dependence motives (eg, taste, cognitive/affective enhancement) were predicted by uncertainty of LGB identity (β = 0.43). Conclusions LGB identity affirmation was associated with primary dependence motives, suggesting that a positive view of one’s sexual orientation is a risk factor for dependence. It may be that identity affirmation is related to stronger involvement with the LGB community, which has smoking-friendly norms. Identity uncertainty was associated with secondary dependence motives; this unique identity challenge may represent a stressor contributing to smoking dependence. Findings can help explain the higher rate of smoking in LGB populations and offer avenues to better tailor smoking cessation interventions. Implications The current study is the first to examine multidimensional aspects of LGB identity in explaining smoking dependence motives among LGB adults. Results reveal that LGB identity challenges are associated with dependence motives, suggesting that interventions targeting these challenges may be help reduce LGB smoking disparities. Specifically, reducing identity uncertainty may help reduce smoking dependence. Though identity affirmation was a smoking dependence correlate, it is counterproductive to reduce affirmation, given its association with other positive health outcomes. Rather, interventions to change LGB community norms around smoking appear warranted, given the documented high overlap between affirmation and community affiliation.",,http://dx.doi.org/10.1093/ntr/ntx061,"Smith, Nathan Grant; Winderman, Kate; King, Brooke; Obasi, Ezemenari M; Reitzel, Lorraine R","Department of Psychological, Health, and Learning Sciences, College of Education, University of Houston, Houston, TX Department of Psychological, Health, and Learning Sciences, College of Education, University of Houston, Houston, TX Department of Psychological, Health, and Learning Sciences, College of Education, University of Houston, Houston, TX Department of Psychological, Health, and Learning Sciences, College of Education, University of Houston, Houston, TX Department of Psychological, Health, and Learning Sciences, College of Education, University of Houston, Houston, TX",,,1,1,
Nicotine & Tobacco Research,2019,"Evaluation of a Randomized Clinical Trial Comparing the Effectiveness of a Culturally Targeted and Nontargeted Smoking Cessation Intervention for Lesbian, Gay, Bisexual, and Transgender Smokers",article,"['bisexual', 'gay', 'lesbian', 'lgbt', 'transgender']","Purpose To examine the benefits of a culturally targeted compared with a nontargeted smoking cessation intervention on smoking cessation outcomes among lesbian, gay, bisexual, and transgender (LGBT) smokers. Methods A prospective randomized design was used to evaluate the added benefits of an LGBT culturally targeted Courage to Quit (CTQ-CT) smoking cessation treatment (N = 172) compared with the standard intervention (CTQ; N = 173). The smoking cessation program consisted of six treatment sessions combined with 8 weeks of nicotine replacement therapy. The primary smoking cessation outcome was 7-day point prevalence quit rates. Secondary outcomes examined included changes in nicotine dependence, nicotine withdrawal, cigarettes per day, smoking urges, self-efficacy, and readiness to quit. Results Overall quit rates were 31.9% at 1 month, 21.1% at 3 months, 25.8% at 6 months, and 22.3% at 12 months. Quit rates did not differ between treatment groups [1 month OR = 0.81 (0.32, 2.09), 3 months OR = 0.65 (0.23, 1.78), 6 months OR = 0.45 (0.17, 1.21), 12 months OR = 0.70 (0.26, 1.91)]. Compared with baseline levels, all secondary smoking cessation outcomes measured were improved at 1 month and were maintained at 12-month follow-up. Compared with the CTQ, the CTQ-CT intervention was more highly rated on program effectiveness (d = 0.2, p = .011), intervention techniques (d = 0.2, p = .014), the treatment manual (d = 0.3, p < .001), and being targeted to the needs of LGBT smokers (d = 0.5, p < .0001). Conclusions LGBT smokers receiving the CTQ intervention achieved smoking cessation outcomes in the range reported for other demographic groups. Cultural targeting improved the acceptability of the intervention but did not confer any additional benefit for smoking cessation outcomes. Implications Study results have implications for understanding the benefits of culturally targeted compared with nontargeted smoking cessation interventions for improving smoking cessation outcomes among LGBT smokers. Shorter and longer term 7-day point prevalence quit rates associated with the targeted and nontargeted interventions were modest but comparable with other group-based interventions delivered in a community setting. Although cultural targeting improved the overall acceptability of the intervention, no added benefits were observed for the culturally targeted intervention on either the primary or secondary outcomes.",,http://dx.doi.org/10.1093/ntr/nty184,"Matthews, Alicia K; Steffen, Alana D; Kuhns, Lisa M; Ruiz, Raymond A; Ross, Nat A; Burke, Larisa A; Li, Chien Ching; King, Andrea C","Department of Health Systems Sciences, College of Nursing, University of Illinois at Chicago, Chicago, IL Department of Health Systems Sciences, College of Nursing, University of Illinois at Chicago, Chicago, IL Department of Pediatrics, Feinberg School of Medicine, Northwestern University, Chicago, IL College of Medicine, Center for Clinical and Translational Science, University of Illinois at Chicago, Chicago, IL Department of Research, Howard Brown Health Center, Chicago, IL Department of Health Systems Sciences, College of Nursing, University of Illinois at Chicago, Chicago, IL Department of Health Services Research, Rush University, Chicago, IL Department of Psychiatry and Behavioral Neuroscience, University of Chicago, Chicago, IL",,,1,1,
Nicotine & Tobacco Research,2019,"Tobacco Advertisement Liking, Vulnerability Factors, and Tobacco Use Among Young Adults",article,"['sex', 'sexual orientation']","Introduction Young adulthood (aged 18–24) is a crucial period in the development of long-term tobacco use patterns. Tobacco advertising and promotion lead to the initiation and continuation of smoking among young adults. We examined whether vulnerability factors moderated the association between tobacco advertisement liking and tobacco use in the United States. Methods Analyses were conducted among 9109 US young adults in the nationally representative Population Assessment of Tobacco and Health (PATH) Study wave 1 (2013–14). Participants viewed 20 randomly selected sets of tobacco advertisements (five each for cigarettes, e-cigarettes, cigars, and smokeless tobacco) and indicated whether they liked each ad. The outcome variables were past 30-day cigarette, e-cigarette, cigar, and smokeless tobacco use. Covariates included tobacco advertisement liking, age, sex, race or ethnicity, sexual orientation, education, poverty level, military service, and internalizing and externalizing mental health symptoms. Results Liking tobacco advertisements was associated with tobacco use, and this association was particularly strong among those with lower educational attainment (cigarettes, cigars) and living below the poverty level (e-cigarettes, smokeless tobacco). Conclusions The association between tobacco advertisement liking and tobacco use was stronger among young adults with lower educational attainment and those living below the poverty level. Policies that restrict advertising exposure and promote counter-marketing messages in this population could reduce their risk. Implications This study shows that liking tobacco advertisements is associated with current tobacco use among young adults, with stronger associations for vulnerable young adults (ie, lower education levels and living below the poverty level). Findings suggest a need for counter-marketing messages, policies that restrict advertising exposure, and educational interventions such as health and media literacy interventions to address the negative influences of tobacco advertisements, especially among young adults with a high school education or less and those living below the poverty level.",,http://dx.doi.org/10.1093/ntr/nty220,"Lienemann, Brianna A; Rose, Shyanika W; Unger, Jennifer B; Meissner, Helen I; Byron, M Justin; Baezconde-Garbanati, Lourdes; Huang, Li-Ling; Cruz, Tess Boley","Department of Preventive Medicine, Keck School of Medicine, University of Southern California, Los Angeles, CA Truth Initiative Schroeder Institute, Washington, DC Department of Preventive Medicine, Keck School of Medicine, University of Southern California, Los Angeles, CA Tobacco Regulatory Science Program, Office of Disease Prevention, National Institutes of Health, Bethesda, MD Lineberger Comprehensive Cancer Center, University of North Carolina at Chapel Hill, Chapel Hill, NC Department of Preventive Medicine, Keck School of Medicine, University of Southern California, Los Angeles, CA Lineberger Comprehensive Cancer Center, University of North Carolina at Chapel Hill, Chapel Hill, NC Master Program in Global Health and Development, Taipei Medical University, Taipei, Taiwan Department of Preventive Medicine, Keck School of Medicine, University of Southern California, Los Angeles, CA",,,1,1,
Nicotine & Tobacco Research,2019,"Lesbian, Gay, Bisexual, and Transgender (LGBT) View it Differently Than Non-LGBT: Exposure to Tobacco-related Couponing, E-cigarette Advertisements, and Anti-tobacco Messages on Social and Traditional Media",article,"['lgbt', 'non-lgbt']","Background LGBT populations use tobacco at disparately higher rates nationwide, compared to national averages. The tobacco industry has a history targeting LGBT with marketing efforts, likely contributing to this disparity. This study explores whether exposure to tobacco content on traditional and social media is associated with tobacco use among LGBT and non-LGBT. Methods This study reports results from LGBT (N = 1092) and non-LGBT (N = 16430) respondents to a 2013 nationally representative cross-sectional online survey of US adults (N = 17522). Frequency and weighted prevalence were estimated and adjusted logistic regression analyses were conducted. Results LGBT reported significantly higher rates of past 30-day tobacco media exposure compared to non-LGBT, this effect was strongest among LGBT who were smokers (p < .05). LGBT more frequently reported exposure to, searching for, or sharing messages related to tobacco couponing, e-cigarettes, and anti-tobacco on new or social media (eg, Twitter, Facebook, etc.) than did non-LGBT (p < .05). Non-LGBT reported more exposure from traditional media sources such as television, most notably anti-tobacco messages (p = .0088). LGBT had higher odds of past 30-day use of cigarettes, e-cigarettes, and cigars compared to non-LGBT, adjusting for past 30-day media exposure and covariates (p ≤ .0001). Conclusions LGBT (particularly LGBT smokers) are more likely to be exposed to and interact with tobacco-related messages on new and social media than their non-LGBT counterparts. Higher levels of tobacco media exposure were significantly associated with higher likelihood of tobacco use. This suggests tobacco control must work toward reaching LGBT across a variety of media platforms, particularly new and social media outlets. Implications This study provides important information about LGBT communities tobacco-related disparities in increased exposure to pro-tobacco messages via social media, where the tobacco industry has moved since the MSA. Further, LGBT when assessed as a single population appear to identify having decreased exposure to anti-tobacco messages via traditional media, where we know a large portion of tobacco control and prevention messages are placed. The study points to the need for targeted and tailored approaches by tobacco control to market to LGBT using on-line resources and tools in order to help reduce LGBT tobacco-related health disparities. Although there have been localized campaigns, only just recently have such LGBT-tailored national campaigns been developed by the CDC, FDA, and Legacy, assessment of the content, effectiveness, and reach of both local and national campaigns will be important next steps.",,http://dx.doi.org/10.1093/ntr/nty049,"Emory, Kristen; Buchting, Francisco O; Trinidad, Dennis R; Vera, Lisa; Emery, Sherry L","Moores Cancer Center at the University of California, San Diego, Health Sciences Dr., La Jolla, CA Graduate School of Public Health, Campanile Drive, San Diego, CA Horizons Foundation, Suite, San Francisco, CA Moores Cancer Center, University of California, San Diego, Health Sciences Dr, La Jolla, CA VeraCite, Inc., San Diego, CA NORC at the University of Chicago, Chicago, IL",,,1,1,
